{
  "schema_version": "1.0.0",
  "scope": "portfolio",
  "deal_id": "shahbaznia-portfolio",
  "portfolio_id": "shahbaznia-portfolio",
  "package_version": "v11",
  "approved_at": "2026-09-03T22:30:55.564981+00:00",
  "approver": "Morgan Wetmore",
  "price": {
    "value": 20500000
  },
  "approved_exception_ids": [
    "shahbaznia-honolulu-3000:MEDIA-provenance",
    "shahbaznia-honolulu-3000:RECON-honolulu-gsr",
    "shahbaznia-honolulu-3000:RULING-onsite-manager",
    "shahbaznia-honolulu-3000:TAX-rate-derivation",
    "shahbaznia-vanowen-16550:MEDIA-provenance",
    "shahbaznia-vanowen-16550:RECON-vanowen-gsr",
    "shahbaznia-vanowen-16550:RECON-vanowen-opex-ratio",
    "shahbaznia-vanowen-16550:RULING-onsite-manager",
    "shahbaznia-vanowen-16550:RULING-vacancy-credit-355",
    "shahbaznia-vanowen-16550:SOURCE-rent-roll-selection",
    "shahbaznia-vanowen-16550:TAX-rate-derivation"
  ],
  "domains": {
    "copy": {
      "content_sha256": "4d0a2095d545bb3a0d15de0a13b4f62c365b47390327e6bac8ac10eaa561f67a"
    },
    "financial_inputs": {
      "content_sha256": "b5de745c9876147957aa2b641096964fe1ee71612987254bc57f383cde2a457b"
    },
    "identity": {
      "content_sha256": "230b47e3efbb92a79547acb3205c12a36a0b165726151bac737f111604cf7240"
    },
    "media_selection": {
      "content_sha256": "4de399f2df6f55958fcc4725157214d3a1257da7a5b7234ae8e18ac5fb492aa9"
    },
    "pricing_decision": {
      "content_sha256": "60a4af6ac503edd6b24c4b734c0693184320fbef5341a6c187dc5b821962eff4"
    },
    "regulatory_conclusions": {
      "content_sha256": "aebaad476ba4746df8611977b480ecdad93795c04c46e0f97d94b5863d04d813"
    },
    "rent_comps": {
      "content_sha256": "1fb2a223f6a475871592d01189351b3211d48757ba759ecd357b54cf5b0eb5b2"
    },
    "sale_comps": {
      "content_sha256": "96a2df61111c31bed59f00d6896ca74d795c2d5e097905c21374d3b8ca278178"
    }
  },
  "legacy_snapshot": false,
  "legacy_label": null,
  "members": {
    "shahbaznia-vanowen-16550": {
      "identity": "e3297fa95d02f81553a660a32402796a2c9799af194690b0beba0d81fd323a85",
      "financial_inputs": "37616713854f19238c86b53956a26121e20a8a62d68ef2dac13fbd17342cd805",
      "pricing_decision": "bcc0e62620af0fd98f30caef1fb047fa8da71acaad523dda536014e343ca8fc9",
      "sale_comps": "dcee0705ffeff924a753fe6fd147c9d27f9c7b44ed07a0aa409e26e28ea7be4a",
      "rent_comps": "a5d5a0bf362d695d68d2e434cc8d7e2865e324146269645483b8b8accb2c9f4b",
      "copy": "34e5d09d9038c96321b3f78624868738ca2813941e2955bbb290780069124bfd",
      "media_selection": "908d1b10d5ebf943bbfa2e5e3b04fcc4693c6fc537c3b625fb405b324056469e",
      "regulatory_conclusions": "a0e129499e9c309ced1c18403698c8d9a064ced57b68d9645013eeb88690c835"
    },
    "shahbaznia-honolulu-3000": {
      "identity": "3d98b076fc56add773bafaf13fb95e3e0b632fe0872020f8bfe8087338902dd0",
      "financial_inputs": "4286f40d1f651ee5b46d2044140e169b8bfd42e2077ba03eb44ca248b17cb64c",
      "pricing_decision": "8f2e0e64700c297b2c4d1c734553926e6977dda5b819c71c8ac59d77e00f68e7",
      "sale_comps": "860409f9efd1b847673b6109b05127c3b8d3bb8bd832010db598cdd2d5f97a48",
      "rent_comps": "e9fd8b00c578a866c7eb537dec4db8b60f270dc89f94da079a24cda8301391e4",
      "copy": "3ebee0f9632f1be052a0ad9ecb4679f53804ae80ba2b75dff70691539afa49e3",
      "media_selection": "bdbe89ff20077df84bd6f595e02686d16bcaf4153c79977ecd9f27a8f506e6e1",
      "regulatory_conclusions": "220f85881ba693876f3e1a607289a43d25fad7df1b09b1316f42a5d8fe09359e"
    }
  }
}
